{
  "$schema": "https://json-schema.org/draft/2020-12/schema",
  "$id": "https://getkexy.com/schemas/prospect-insights.schema.json",
  "title": "Prospect insights",
  "description": "The `data` of GET /v2/drip-campaigns/:campaignId/prospects/insights?email=<email>: the newest answer KexyApi stored from the Prospect Insights API (called once per AI email, just before it is written; see KexyApi docs/insights-api-mapping.md). Drives the left column of the prospect profile ('Why we chose this lead', 'How we picked the opening topic'). 403 until the prospect has opened an email; with no answer yet, callout/openerSelection/generatedAt are null and signals is []. 'What happened so far' and who the prospect is are NOT part of this API. openerSelection.outcome is worked out by KexyApi from its own tracking (drip_campaign_insignts), never taken from the AI. The standard ResponseSuccessInterceptor wraps it as { success, statusCode, path, data, timestamp }. Every piece of text is shown to the user as-is.",
  "type": "object",
  "additionalProperties": false,
  "required": [
    "email",
    "callout",
    "signals",
    "openerSelection",
    "generatedAt"
  ],
  "properties": {
    "email": {
      "type": "string",
      "format": "email",
      "description": "The prospect's email, echoed back exactly as requested."
    },
    "callout": {
      "description": "Highlighted box at the top of 'Why we chose this lead'. Rendered as '<b>title</b> message <b>Next step: nextStep</b>'. null to hide it.",
      "oneOf": [
        {
          "type": "null"
        },
        {
          "type": "object",
          "additionalProperties": false,
          "required": [
            "tone",
            "title",
            "message",
            "nextStep"
          ],
          "properties": {
            "tone": {
              "type": "string",
              "description": "'replied', 'positive', 'neutral' and 'warning' get their own colour; any other tone is shown neutral."
            },
            "title": {
              "type": "string",
              "minLength": 1,
              "maxLength": 80,
              "description": "e.g. 'Peter replied on Sep 19:'"
            },
            "message": {
              "type": "string",
              "minLength": 1,
              "maxLength": 240
            },
            "nextStep": {
              "type": [
                "string",
                "null"
              ],
              "maxLength": 160,
              "description": "Text after 'Next step:'. null to omit."
            }
          }
        }
      ]
    },
    "signals": {
      "type": "array",
      "maxItems": 10,
      "description": "Everything found about the prospect, ORDERED BY confidence DESCENDING, at most 10 (keep the most confident). The UI shows the first two and puts the rest behind '+N more, lower confidence · view all'. May be empty.",
      "items": {
        "$ref": "#/$defs/signal"
      }
    },
    "openerSelection": {
      "description": "'How we picked the opening topic'. null before any opener has been chosen.",
      "oneOf": [
        {
          "type": "null"
        },
        {
          "type": "object",
          "additionalProperties": false,
          "required": [
            "winnerKey",
            "outcome",
            "candidates",
            "rule"
          ],
          "properties": {
            "winnerKey": {
              "type": "string",
              "enum": [
                "local",
                "personal",
                "business",
                "pain_point",
                "lead_magnet"
              ],
              "description": "The opening angle chosen for the email (Insights' openerSelection.winnerKey). Must be present in candidates."
            },
            "outcome": {
              "type": "string",
              "enum": [
                "pending",
                "sent",
                "opened",
                "replied",
                "no_response"
              ],
              "description": "What happened with the email the winning opener was used in, from KexyApi's tracking. pending = not sent yet; no_response = nothing yet and a later email has gone out."
            },
            "candidates": {
              "type": "array",
              "minItems": 1,
              "maxItems": 8,
              "description": "Every opener that was compared, ORDERED BY score DESCENDING.",
              "items": {
                "type": "object",
                "additionalProperties": false,
                "required": [
                  "key",
                  "label",
                  "score"
                ],
                "properties": {
                  "key": {
                    "type": "string",
                    "pattern": "^[a-z][a-z0-9_]*$"
                  },
                  "label": {
                    "type": "string",
                    "minLength": 1,
                    "maxLength": 40,
                    "description": "e.g. 'His LinkedIn post'"
                  },
                  "score": {
                    "type": "integer",
                    "minimum": 0,
                    "maximum": 100
                  }
                }
              }
            },
            "rule": {
              "description": "Footnote under the bars. null to hide.",
              "oneOf": [
                {
                  "type": "null"
                },
                {
                  "type": "object",
                  "additionalProperties": false,
                  "required": [
                    "label",
                    "text"
                  ],
                  "properties": {
                    "label": {
                      "type": "string",
                      "minLength": 1,
                      "maxLength": 40,
                      "description": "Bold lead-in, e.g. 'Rule in action'."
                    },
                    "text": {
                      "type": "string",
                      "minLength": 1,
                      "maxLength": 240
                    }
                  }
                }
              ]
            }
          }
        }
      ]
    },
    "generatedAt": {
      "type": [
        "string",
        "null"
      ],
      "format": "date-time",
      "description": "When this answer was produced (ISO 8601, UTC); null when there is no answer yet."
    }
  },
  "$defs": {
    "signal": {
      "type": "object",
      "additionalProperties": false,
      "required": [
        "id",
        "kind",
        "title",
        "timing",
        "quote",
        "source",
        "usedIn",
        "reason",
        "confidence"
      ],
      "properties": {
        "id": {
          "type": "string",
          "minLength": 1
        },
        "kind": {
          "type": "string",
          "description": "The kind of fact, as the Insights API labels it (e.g. 'company_news'). The full list isn't published; the page shows title, never this."
        },
        "title": {
          "type": "string",
          "minLength": 1,
          "maxLength": 60,
          "description": "Card heading, e.g. 'What he shared on LinkedIn'."
        },
        "timing": {
          "type": [
            "string",
            "null"
          ],
          "maxLength": 60,
          "description": "Grey text after the heading, e.g. '5 days before we emailed' or 'recent'."
        },
        "quote": {
          "type": "string",
          "minLength": 1,
          "maxLength": 600,
          "description": "The prospect's words, verbatim. No surrounding quote marks — the UI adds them."
        },
        "source": {
          "type": "object",
          "additionalProperties": false,
          "required": [
            "platform",
            "attribution",
            "url"
          ],
          "properties": {
            "platform": {
              "type": "string",
              "minLength": 1,
              "maxLength": 40,
              "description": "e.g. 'LinkedIn'."
            },
            "attribution": {
              "type": [
                "string",
                "null"
              ],
              "maxLength": 80,
              "description": "e.g. 'shared by John McDonald' or 'his own post'."
            },
            "url": {
              "type": [
                "string",
                "null"
              ],
              "format": "uri",
              "description": "Link to the original. Shows 'View post' when set."
            }
          }
        },
        "usedIn": {
          "description": "Set when this signal opened a sent email. Shows a badge like 'OPENED EMAIL 1 · GOT THE REPLY'.",
          "oneOf": [
            {
              "type": "null"
            },
            {
              "type": "object",
              "additionalProperties": false,
              "required": [
                "emailSequence",
                "outcome"
              ],
              "properties": {
                "emailSequence": {
                  "type": "integer",
                  "minimum": 1,
                  "description": "1-based position of the email in the drip sequence."
                },
                "outcome": {
                  "type": "string",
                  "enum": [
                    "sent",
                    "opened",
                    "clicked",
                    "replied"
                  ]
                }
              }
            }
          ]
        },
        "reason": {
          "type": "object",
          "additionalProperties": false,
          "required": [
            "label",
            "text"
          ],
          "properties": {
            "label": {
              "type": "string",
              "minLength": 1,
              "maxLength": 40,
              "description": "e.g. 'Why we used it' or 'Why it matters'."
            },
            "text": {
              "type": "string",
              "minLength": 1,
              "maxLength": 240
            }
          }
        },
        "confidence": {
          "type": "number",
          "minimum": 0,
          "maximum": 1
        }
      }
    }
  }
}
